{
    "id": "cronica_base",
    "name": "CRONICĂ — Pachetul de bază",
    "version": "1.0.0",
    "prompts": [
        {
            "id": "cronica_001",
            "text": "Descrie momentul în care [PLAYER] a intrat în lift cu fostul său șef și liftul s-a blocat între etaje.",
            "category": "munca",
            "safeMode": true,
            "minPlayers": 2
        },
        {
            "id": "cronica_002",
            "text": "Ce secret îngrozitor a descoperit [PLAYER] în dulapul bunicii sale?",
            "category": "familie",
            "safeMode": true,
            "minPlayers": 2
        },
        {
            "id": "cronica_003",
            "text": "Care a fost motivul real pentru care [PLAYER] a fost dat afară de la locul de muncă anterior?",
            "category": "munca",
            "safeMode": true,
            "minPlayers": 2
        },
        {
            "id": "cronica_004",
            "text": "Descrie cu lux de amănunte cearta dintre [PLAYER] și vecinul de la etaj 4 din cauza mașinii de spălat.",
            "category": "scandal_de_bloc",
            "safeMode": true,
            "minPlayers": 2
        },
        {
            "id": "cronica_005",
            "text": "Care este planul secret al lui [PLAYER] de a deveni cel mai bogat om din cartier?",
            "category": "ambitie",
            "safeMode": true,
            "minPlayers": 2
        },
        {
            "id": "cronica_006",
            "text": "Descrie aventura neașteptată a lui [PLAYER] la supermarketul din colț la ora 11 noaptea.",
            "category": "situatie_absurda",
            "safeMode": true,
            "minPlayers": 2
        },
        {
            "id": "cronica_007",
            "text": "Ce a găsit [PLAYER] sub canapea când a mutat mobila pentru prima dată în 3 ani?",
            "category": "situatie_absurda",
            "safeMode": true,
            "minPlayers": 2
        },
        {
            "id": "cronica_008",
            "text": "Descrie momentul în care [PLAYER] a trimis un mesaj greșit persoanei greșite și consecințele devastatoare.",
            "category": "decizie_proasta",
            "safeMode": true,
            "minPlayers": 2
        },
        {
            "id": "cronica_009",
            "text": "Ce poveste romantică nespusă există între [PLAYER] și [PLAYER2]?",
            "category": "relatie",
            "safeMode": true,
            "minPlayers": 3
        },
        {
            "id": "cronica_010",
            "text": "Descrie bătălia epică pentru ultimul loc de parcare dintre [PLAYER] și doamna Vișinescu.",
            "category": "scandal_de_bloc",
            "safeMode": true,
            "minPlayers": 2
        },
        {
            "id": "cronica_011",
            "text": "Ce cadou absolut dezastruos a cumpărat [PLAYER] pentru nunta verișoarei sale?",
            "category": "familie",
            "safeMode": true,
            "minPlayers": 2
        },
        {
            "id": "cronica_012",
            "text": "Cum a reușit [PLAYER] să transforme o ședință de zoom de 15 minute într-un dezastru de 3 ore?",
            "category": "munca",
            "safeMode": true,
            "minPlayers": 2
        },
        {
            "id": "cronica_013",
            "text": "Care este alianta secretă dintre [PLAYER] și [PLAYER2] împotriva restului grupului?",
            "category": "infuntare",
            "safeMode": true,
            "minPlayers": 3
        },
        {
            "id": "cronica_014",
            "text": "Descrie expediția lui [PLAYER] la IKEA care a durat 7 ore și s-a terminat fără mobilă.",
            "category": "aventura",
            "safeMode": true,
            "minPlayers": 2
        },
        {
            "id": "cronica_015",
            "text": "Ce decizie financiară catastrofală a luat [PLAYER] în urmă cu două săptămâni?",
            "category": "decizie_proasta",
            "safeMode": true,
            "minPlayers": 2
        },
        {
            "id": "cronica_016",
            "text": "Descrie motivul real pentru care [PLAYER] a blocat numărul soacrei sale.",
            "category": "relatie",
            "safeMode": true,
            "minPlayers": 2
        },
        {
            "id": "cronica_017",
            "text": "Ce plan ambițios are [PLAYER] de a cuceri piața de mici din cartier?",
            "category": "ambitie",
            "safeMode": true,
            "minPlayers": 2
        },
        {
            "id": "cronica_018",
            "text": "Descrie incidentul diplomatic dintre [PLAYER] și pisica vecinului de la scara B.",
            "category": "scandal_de_bloc",
            "safeMode": true,
            "minPlayers": 2
        },
        {
            "id": "cronica_019",
            "text": "Ce secret de familie a dezvăluit accidental [PLAYER] la masa de Crăciun?",
            "category": "secret",
            "safeMode": true,
            "minPlayers": 2
        },
        {
            "id": "cronica_020",
            "text": "Cum a explicat [PLAYER] colegilor de serviciu că a venit cu o oră întârziere din cauza unui porumbel?",
            "category": "situatie_absurda",
            "safeMode": true,
            "minPlayers": 2
        },
        {
            "id": "cronica_021",
            "text": "Care este rivalitatea nerezolvată dintre [PLAYER] și fratele său mai mic?",
            "category": "familie",
            "safeMode": true,
            "minPlayers": 2
        },
        {
            "id": "cronica_022",
            "text": "Descrie aventura lui [PLAYER] când a încercat să repare singur instalația de apă.",
            "category": "aventura",
            "safeMode": true,
            "minPlayers": 2
        },
        {
            "id": "cronica_023",
            "text": "Ce secret profesional a vândut accidental [PLAYER] la un grătar cu colegii?",
            "category": "secret",
            "safeMode": false,
            "minPlayers": 2
        },
        {
            "id": "cronica_024",
            "text": "Descrie înfruntarea finală dintre [PLAYER] și [PLAYER2] pentru titlul de cel mai bun bucătar din grup.",
            "category": "infuntare",
            "safeMode": true,
            "minPlayers": 3
        },
        {
            "id": "cronica_025",
            "text": "Ce hobby ciudat a ascuns [PLAYER] față de toți timp de 5 ani?",
            "category": "secret",
            "safeMode": true,
            "minPlayers": 2
        },
        {
            "id": "cronica_026",
            "text": "Descrie momentul în care [PLAYER] a confundat o ședință importantă cu o petrecere de pensionare.",
            "category": "munca",
            "safeMode": true,
            "minPlayers": 2
        },
        {
            "id": "cronica_027",
            "text": "Cum a reușit [PLAYER] să piardă mașina în parcarea unui mall timp de 4 ore?",
            "category": "situatie_absurda",
            "safeMode": true,
            "minPlayers": 2
        },
        {
            "id": "cronica_028",
            "text": "Ce pact secret au încheiat [PLAYER] și [PLAYER2] împotriva unui coleg urât?",
            "category": "munca",
            "safeMode": false,
            "minPlayers": 3
        },
        {
            "id": "cronica_029",
            "text": "Descrie planul lui [PLAYER] de a deveni influencer după vârsta de 40 de ani.",
            "category": "ambitie",
            "safeMode": true,
            "minPlayers": 2
        },
        {
            "id": "cronica_030",
            "text": "Care este motivul adevărat pentru care [PLAYER] a rupt logodna acum 3 ani?",
            "category": "relatie",
            "safeMode": false,
            "minPlayers": 2
        },
        {
            "id": "cronica_031",
            "text": "Descrie expediția de aventură a lui [PLAYER] la munte care a durat 2 km și s-a terminat cu ambulanța.",
            "category": "aventura",
            "safeMode": true,
            "minPlayers": 2
        },
        {
            "id": "cronica_032",
            "text": "Ce decizie proastă a luat [PLAYER] după ce a văzut un tutorial pe YouTube?",
            "category": "decizie_proasta",
            "safeMode": true,
            "minPlayers": 2
        },
        {
            "id": "cronica_033",
            "text": "Descrie petrecerea de ziua lui [PLAYER] la care au venit doar 2 persoane.",
            "category": "situatie_absurda",
            "safeMode": true,
            "minPlayers": 2
        },
        {
            "id": "cronica_034",
            "text": "Ce scandal epic s-a petrecut pe grupul de WhatsApp al familiei lui [PLAYER] luna trecută?",
            "category": "familie",
            "safeMode": true,
            "minPlayers": 2
        },
        {
            "id": "cronica_035",
            "text": "Descrie rivalitatea dintre [PLAYER] și [PLAYER2] pentru același post de manager.",
            "category": "infuntare",
            "safeMode": true,
            "minPlayers": 3
        },
        {
            "id": "cronica_036",
            "text": "Ce plan megaloman are [PLAYER] pentru a-și îmbunătăți nota de la asociația de proprietari?",
            "category": "scandal_de_bloc",
            "safeMode": true,
            "minPlayers": 2
        },
        {
            "id": "cronica_037",
            "text": "Care este secretul rușinos pe care [PLAYER] îl ascunde față de [PLAYER2]?",
            "category": "secret",
            "safeMode": false,
            "minPlayers": 3
        },
        {
            "id": "cronica_038",
            "text": "Descrie aventura culinară a lui [PLAYER] când a încercat să facă sarmale pentru prima dată.",
            "category": "aventura",
            "safeMode": true,
            "minPlayers": 2
        },
        {
            "id": "cronica_039",